{
  "schema_version": "1.0",
  "task_id": "PROJECT-LEADER-HUMAN-GATE-CLOSURE-060",
  "repository": "martaxi-boss/Project-leader",
  "sequence": 4,
  "recorded_at": "2026-10-04T18:58:54.883285Z",
  "event": "RECOVERED",
  "strategy_generation": 2,
  "action_fingerprint": "task060|github|publish-task-implementation|native-git-data",
  "attempt_count": 1,
  "identical_failure_count": 0,
  "no_progress_iterations": 0,
  "previous_event_sha256": "7985d0015a7b6d425f92faae9352aa85a64def31dffb7e44c34dfd72679e62e5",
  "detail": "Native Git-data publication succeeded and was independently read back at implementation ae30f434f4e98f3ae9f6bd5e7979edbd468bff90. Exact implementation-head required CI is green. The direct HTTPS transport failure was resolved without credentials, duplicate writes, Git push retries, expanded authority or Owner intervention; return to Supervisor for final-head governance and the authorized merge."
}
