{
  "schema_version": "1.0",
  "task_id": "PROJECT-LEADER-NONINTERACTIVE-FALLBACK-HYGIENE-043",
  "repository": "martaxi-boss/Project-leader",
  "sequence": 1,
  "recorded_at": "2026-10-04T02:09:00Z",
  "event": "FAILURE_OBSERVED",
  "strategy_generation": 1,
  "action_fingerprint": "PROJECT-LEADER-NONINTERACTIVE-FALLBACK-HYGIENE-043|PR43|initial CI|compatibility pins and pre-result trusted gate",
  "attempt_count": 1,
  "identical_failure_count": 1,
  "no_progress_iterations": 1,
  "previous_event_sha256": null,
  "detail": "Initial PR43 CI on head c240c33388d28b3ca8c906b02ab62bdeb5990f6c failed. Control contract tests run 37170078566 found two local compatibility assertions: plugin version pins still require Project Leader 0.6.0 / Recovery Guardian 0.5.0, and the new skill text assertion used a non-literal phrase. Validate control plane run 37170078572 failed for the same existing manifest version pins. Trusted authorization gate run 37170078536 correctly failed because the final Worker Result is not yet present; it must not be bypassed. Remediate only the local compatibility drift, preserve the new fallback contract, keep package/runtime identity consistent, then obtain fresh descendant CI. Do not weaken trusted validation."
}
