{
  "schema_version": "1.0",
  "task_id": "PROJECT-LEADER-CONTROL-EVIDENCE-HYGIENE-059",
  "repository": "martaxi-boss/Project-leader",
  "sequence": 1,
  "recorded_at": "2026-10-04T14:37:00Z",
  "event": "FAILURE_OBSERVED",
  "strategy_generation": 1,
  "action_fingerprint": "PROJECT-LEADER-CONTROL-EVIDENCE-HYGIENE-059|trusted-gate|base-policy-required-validation-missing",
  "attempt_count": 1,
  "identical_failure_count": 1,
  "no_progress_iterations": 0,
  "previous_event_sha256": null,
  "detail": "Trusted authorization gate rejected task 059 because its immutable E3 Task Authorization omitted the base-policy required validation 'Trust-root governance path'. The implementation is evidence-only and does not alter the trust root, but the policy minimum is structural. Do not weaken the gate and do not edit the immutable task retroactively."
}
