{
  "schema_version": "1.0",
  "task_id": "PROJECT-LEADER-HUMAN-GATE-CLOSURE-060",
  "repository": "martaxi-boss/Project-leader",
  "sequence": 1,
  "recorded_at": "2026-10-04T18:37:22.178254Z",
  "event": "FAILURE_OBSERVED",
  "strategy_generation": 1,
  "action_fingerprint": "task060|github|publish-control-records|git-https",
  "attempt_count": 2,
  "identical_failure_count": 1,
  "no_progress_iterations": 2,
  "previous_event_sha256": null,
  "detail": "Direct HTTPS Git push failed because no credential helper is available, then the dependent push reported no upstream. Live native GitHub ref read proved the task branch absent; no implementation had started and no ambiguous effect was repeated. Reconstructed state and published the immutable authorization-only task through native GitHub Git-data capabilities."
}
