{
  "schema_version": "1.0",
  "task_id": "PROJECT-LEADER-EVIDENCE-HYGIENE-CONVERGENCE-051",
  "repository": "martaxi-boss/Project-leader",
  "sequence": 3,
  "recorded_at": "2026-10-04T11:36:20Z",
  "event": "RETRY_AUTHORIZED",
  "strategy_generation": 2,
  "action_fingerprint": "preserve-evidence-bounded-batches",
  "attempt_count": 2,
  "identical_failure_count": 1,
  "no_progress_iterations": 1,
  "previous_event_sha256": "51783278ae43b9e44940d6f5b7e3e5625f03784baedf2e439b98785d99f7481c",
  "detail": "Retry is authorized only after durable branch verification showed no prior implementation ref update. Execute the bounded-batch preservation strategy and verify resulting branch state before any further retry."
}
