{
  "schema_version": "1.0",
  "task_id": "PROJECT-LEADER-CANONICAL-RUNTIME-BOOTSTRAP-056",
  "repository": "martaxi-boss/Project-leader",
  "sequence": 2,
  "recorded_at": "2026-10-04T12:22:00Z",
  "event": "REPLAN",
  "strategy_generation": 2,
  "action_fingerprint": "PROJECT-LEADER-CANONICAL-RUNTIME-BOOTSTRAP-056|PR56|supersede immutable packet with corrected clean task",
  "attempt_count": 1,
  "identical_failure_count": 1,
  "no_progress_iterations": 1,
  "previous_event_sha256": "407bbc218dadabe93c7f55b5b2f14713ab6cb866a8354e6828a7930dd4bdc392",
  "detail": "Abandon PR #56 unmerged and create a clean replacement task from canonical main. The replacement must preserve the same Owner objective, include every project-policy required prohibition before any implementation, bind a fresh immutable authorization commit, and include both authorization_commit_sha and authorization_sha256 in the final Worker Result. Reuse the already-audited implementation design, but do not reuse the invalid task packet as authority."
}
