{
  "schema_version": "1.0",
  "task_id": "PROJECT-LEADER-HUMAN-GATE-CLOSURE-060",
  "repository": "martaxi-boss/Project-leader",
  "sequence": 3,
  "recorded_at": "2026-10-04T18:50:21.280518Z",
  "event": "RETRY_AUTHORIZED",
  "strategy_generation": 2,
  "action_fingerprint": "task060|github|publish-task-implementation|native-git-data",
  "attempt_count": 1,
  "identical_failure_count": 0,
  "no_progress_iterations": 0,
  "previous_event_sha256": "bae11464b4a0987c9276a766918db80263a55d32d0e927139d0ce249c30ef8c3",
  "detail": "Authorize bounded implementation publication through the already working native Git-data channel after Supervisor scope/validation review. The transport replan preserves existing task authority. No direct HTTPS Git push retry, duplicate CI run, credential change or Owner intervention is authorized."
}
