{
  "schema_version": "1.0",
  "task_id": "PROJECT-LEADER-ACCESS-DISCOVERY-HYGIENE-042",
  "repository": "martaxi-boss/Project-leader",
  "sequence": 3,
  "recorded_at": "2026-10-03T23:40:00Z",
  "event": "RECOVERED",
  "strategy_generation": 1,
  "action_fingerprint": "PROJECT-LEADER-ACCESS-DISCOVERY-HYGIENE-042|PR42|Control contract tests|historical failed transition pair entered certifying transition namespace",
  "attempt_count": 2,
  "identical_failure_count": 1,
  "no_progress_iterations": 1,
  "previous_event_sha256": "d511b0b108e0db7b9faec74d749e8891fcf81f14f2d611cd7167756900a1cbc7",
  "detail": "Fresh descendant implementation head 54914dbc33e3de6815097cbd916fdc853acdb983 passed Control contract tests 37162403493, Validate control plane 37162403486, and Package ChatGPT plugins 37162403487. The failed historical 041 merge attempt is preserved as non-certifying archive evidence, the successful MERGE-002 pair remains certifying evidence, and transition validation was not weakened."
}
